{"aihot_items":[{"attribution":{"canonical":"https://aihot.news/items/gqh4yclcjmaci6uhur56580uh","source":"AIHOT"},"category":"paper","id":"gqh4yclcjmaci6uhur56580uh","permalink":"https://aihot.news/items/gqh4yclcjmaci6uhur56580uh","published_at":"2026-10-03T22:56:48Z","ref":"A1","score":65,"selected":true,"source":"Hugging Face：Blog（RSS）","summary":"Microsoft 与 Hugging Face 发布 ThinkingBox 智能体沙箱与 ThinkingBox-Bench 基准，覆盖 507 个有状态业务工作流、每任务运行 20 次，以终局数据库状态和副作用作可执行判定，现可通过 OpenEnv 在 Hugging Face 上运行。","title":"Microsoft ThinkingBox 在 Hugging Face 上发布，以数据库终态和 20 次重复评测智能体","title_en":"The Agent Said It Was Done. The Database Disagreed.","url":"https://huggingface.co/blog/microsoft/thinkingbox"}],"counts":{"aihot_published":1,"aihot_upstream":1,"trendradar_matched":12,"trendradar_published":12,"trendradar_raw":293},"generated_at":"2026-10-05T06:29:53+08:00","report_date":"2026-10-05","run_id":"20261005T062953+0800","schema_version":1,"source_status":{"aihot":{"api_version":"2.0.0","page_count":1,"status":"live"},"trendradar":{"platform_count":11,"snapshot_count":3,"status":"live"}},"timezone":"Asia/Shanghai","trendradar_items":[{"crawl_count":3,"first_crawl_time":"2026-10-05T03:48:33+08:00","id":"866ecacaba1148902305e197","last_crawl_time":"2026-10-05T06:29:09+08:00","platform":"凤凰网","platform_id":"ifeng","rank":1,"rank_change":0,"ref":"N1","title":"特朗普“AI沙皇”人选曝光","url":"https://news.ifeng.com/c/8wwrNBWlavW"},{"crawl_count":3,"first_crawl_time":"2026-10-05T03:48:33+08:00","id":"1bed7718f8156ec978fcb2b8","last_crawl_time":"2026-10-05T06:29:09+08:00","platform":"财联社热门","platform_id":"cls-hot","rank":5,"rank_change":0,"ref":"N2","title":"人形机器人进驻爱仕达百家终端：从门店上岗到产业实践","url":"https://www.cls.cn/detail/2495303"},{"crawl_count":3,"first_crawl_time":"2026-10-05T03:48:33+08:00","id":"1107eca1fa9b3c814c3340fd","last_crawl_time":"2026-10-05T06:29:09+08:00","platform":"华尔街见闻","platform_id":"wallstreetcn-hot","rank":5,"rank_change":0,"ref":"N3","title":"一向力挺AI的孙正义突然警告：超级智能可能“极其危险”","url":"https://wallstreetcn.com/articles/3782987"},{"crawl_count":3,"first_crawl_time":"2026-10-05T03:48:33+08:00","id":"e50a7f144aa7b7bf7ff1f012","last_crawl_time":"2026-10-05T06:29:09+08:00","platform":"华尔街见闻","platform_id":"wallstreetcn-hot","rank":6,"rank_change":0,"ref":"N4","title":"美银：“AI交易”是当前美债市场“最后一道防线”","url":"https://wallstreetcn.com/articles/3782975"},{"crawl_count":3,"first_crawl_time":"2026-10-05T03:48:33+08:00","id":"40ec10bb64e636e5a57fb8b2","last_crawl_time":"2026-10-05T06:29:09+08:00","platform":"华尔街见闻","platform_id":"wallstreetcn-hot","rank":7,"rank_change":0,"ref":"N5","title":"OpenAI「12朝元老」辞职死谏：试错的时代已崩坏！","url":"https://wallstreetcn.com/articles/3782981"},{"crawl_count":3,"first_crawl_time":"2026-10-05T03:48:33+08:00","id":"3d7b56925336727599b5e55c","last_crawl_time":"2026-10-05T06:29:09+08:00","platform":"华尔街见闻","platform_id":"wallstreetcn-hot","rank":8,"rank_change":0,"ref":"N6","title":"贝森特“灭火”：美债收益率上升属全球现象，驳斥AI泡沫担忧","url":"https://wallstreetcn.com/articles/3782969"},{"crawl_count":3,"first_crawl_time":"2026-10-05T03:48:33+08:00","id":"66bf56c9109f199eb05b3cd2","last_crawl_time":"2026-10-05T06:29:09+08:00","platform":"财联社热门","platform_id":"cls-hot","rank":9,"rank_change":-1,"ref":"N7","title":"美股收盘：英伟达盘中破纪录 纳斯达克100指数收新高","url":"https://www.cls.cn/detail/2497450"},{"crawl_count":3,"first_crawl_time":"2026-10-05T03:48:33+08:00","id":"13dcf2745635a7a04e4b90c9","last_crawl_time":"2026-10-05T06:29:09+08:00","platform":"华尔街见闻","platform_id":"wallstreetcn-hot","rank":10,"rank_change":0,"ref":"N8","title":"白宫AI峰会“权力图谱”：扎克伯格最受特朗普认可，马斯克刻意疏离，Amodei焦虑藏不住","url":"https://wallstreetcn.com/articles/3782984"},{"crawl_count":3,"first_crawl_time":"2026-10-05T03:48:33+08:00","id":"0d0efca5047725c1c59d063f","last_crawl_time":"2026-10-05T06:29:09+08:00","platform":"财联社热门","platform_id":"cls-hot","rank":12,"rank_change":0,"ref":"N9","title":"AI数据中心建设加速之际 地方阻力从美国蔓延至欧洲和亚洲","url":"https://www.cls.cn/detail/2497590"},{"crawl_count":2,"first_crawl_time":"2026-10-05T03:48:33+08:00","id":"80dce61d90ba7bf334bbb2e3","last_crawl_time":"2026-10-05T05:53:02+08:00","platform":"澎湃新闻","platform_id":"thepaper","rank":19,"rank_change":0,"ref":"N10","title":"中国团队拿下最佳故事奖，从阿斯塔纳这个电影节看AI的惊艳与短板","url":"https://www.thepaper.cn/newsDetail_forward_34198273"},{"crawl_count":3,"first_crawl_time":"2026-10-05T03:48:33+08:00","id":"817da35ab099740ba7af6306","last_crawl_time":"2026-10-05T06:29:09+08:00","platform":"今日头条","platform_id":"toutiao","rank":19,"rank_change":-9,"ref":"N11","title":"换汤不换药的AI短剧还能“不烧心”吗","url":"https://www.toutiao.com/trending/7692782520934432811/"},{"crawl_count":2,"first_crawl_time":"2026-10-05T03:48:33+08:00","id":"cab17c30e3500f5aeb471838","last_crawl_time":"2026-10-05T06:29:09+08:00","platform":"bilibili 热搜","platform_id":"bilibili-hot-search","rank":23,"rank_change":-14,"ref":"N12","title":"中美AI治理是否迎来拐点","url":"https://search.bilibili.com/all?keyword=%E4%B8%AD%E7%BE%8EAI%E6%B2%BB%E7%90%86%E6%98%AF%E5%90%A6%E8%BF%8E%E6%9D%A5%E6%8B%90%E7%82%B9"}],"warnings":[],"window_end":"2026-10-05T06:29:53+08:00","window_start":"2026-10-04T06:29:53+08:00"}
