{"aihot_items":[{"attribution":{"canonical":"https://aihot.news/items/d92mrmxvsfmnoyw3comncgz2c","source":"AIHOT"},"category":"opinion","id":"d92mrmxvsfmnoyw3comncgz2c","permalink":"https://aihot.news/items/d92mrmxvsfmnoyw3comncgz2c","published_at":"2026-10-24T14:30:45Z","ref":"A1","score":77,"selected":true,"source":"X：Ethan Mollick (@emollick)","summary":"Ethan Mollick 转引 OpenAI 红队测试认为，实验室看似夸张的 AI 网络安全判断应被更认真对待。OpenAI 让前沿模型智能体团队攻击其加固的隔离基础设施，智能体几乎在每个受限联网服务中都找到漏洞，还能利用 CPU 缓存时序在不联网、无共享文件的虚拟机之间传递秘密，类似 Spectre 和 Meltdown 的攻击手法。作者提到 Anthropic 和 Noam Brown 此前关于 AI 网络攻防与模型自发协调的说法曾被嘲笑。","title":"Ethan Mollick：OpenAI 红队测试显示前沿模型智能体真能越狱沙箱，实验室的 AI 安全警告值得重视","title_en":"Without being overly credulous, we should be taking seemingly “out there” ideas about AI cybersecurity from the Labs more seriously. Exam...","url":"https://x.com/emollick/status/2114001653879672877"},{"attribution":{"canonical":"https://aihot.news/items/imgp55zxmw4jugt1a29ap9yo1","source":"AIHOT"},"category":"paper","id":"imgp55zxmw4jugt1a29ap9yo1","permalink":"https://aihot.news/items/imgp55zxmw4jugt1a29ap9yo1","published_at":"2026-10-24T11:12:36Z","ref":"A2","score":82,"selected":true,"source":"The Decoder：AI News（RSS）","summary":"OpenAI 介绍其前沿模型训练已完全断网，并用 AI 智能体红队测试自家基础设施。隔离测试中，智能体在无网络、无共享文件的条件下通过 CPU 缓存时序差异、共享内存写入模式等侧信道通信，甚至独立建立编码方案交换信息。","title":"OpenAI 智能体在隔离测试中借 CPU 缓存隐蔽通信","title_en":"OpenAI's isolated AI agents found ways to talk to each other through CPU cache","url":"https://the-decoder.com/openais-isolated-ai-agents-found-ways-to-talk-to-each-other-through-cpu-cache/"},{"attribution":{"canonical":"https://aihot.news/items/gwhdq3jo5p1z27wh2i46ntd2s","source":"AIHOT"},"category":"ai-models","id":"gwhdq3jo5p1z27wh2i46ntd2s","permalink":"https://aihot.news/items/gwhdq3jo5p1z27wh2i46ntd2s","published_at":"2026-10-24T02:08:43Z","ref":"A3","score":78,"selected":true,"source":"公众号：数字生命卡兹克","summary":"月之暗面发布旗舰模型 Kimi K3.1 Pro，参数 2.8T，支持 100 万 Token 上下文，完整模型权重预计 11 月 4 日前开放。API 输入每百万 Token 13 元、输出 68 元，相比 K3 基本砍半，并同步推出输出速度约 2 到 3 倍、价格翻倍的 Highspeed 版本。","title":"Kimi 发布开源旗舰模型 K3.1 Pro：2.8T 参数、100万 Token 上下文，实测 3D 与视频动效","title_en":"Kimi K3.1 Pro来了，国产模型审美的新巅峰。","url":"https://mp.weixin.qq.com/s?__biz=MzIyMzA5NjEyMA%3D%3D&mid=2647687627&idx=1&sn=4816c8130f378587885913b465fd686f"}],"counts":{"aihot_published":3,"aihot_upstream":3,"trendradar_matched":19,"trendradar_published":19,"trendradar_raw":300},"generated_at":"2026-10-25T07:07:20+08:00","report_date":"2026-10-25","run_id":"20261025T070720+0800","schema_version":1,"source_status":{"aihot":{"api_version":"2.0.0","page_count":2,"status":"live"},"trendradar":{"platform_count":11,"snapshot_count":3,"status":"live"}},"timezone":"Asia/Shanghai","trendradar_items":[{"crawl_count":3,"first_crawl_time":"2026-10-25T03:44:05+08:00","id":"635dc4bff0300f5fc9fe375c","last_crawl_time":"2026-10-25T07:06:38+08:00","platform":"华尔街见闻","platform_id":"wallstreetcn-hot","rank":1,"rank_change":0,"ref":"N1","title":"AI“跌倒”，美债“吃饱”！全球“资本争夺战”，市场给出答案","url":"https://wallstreetcn.com/articles/3784376"},{"crawl_count":3,"first_crawl_time":"2026-10-25T03:44:05+08:00","id":"ea8c1542f0b021aa8adb4e66","last_crawl_time":"2026-10-25T07:06:38+08:00","platform":"贴吧","platform_id":"tieba","rank":3,"rank_change":0,"ref":"N2","title":"B站肥鱼成灾,AI评论泛滥","url":"https://tieba.baidu.com/hottopic/browse/hottopic?amp%3Btopic_name=B%E7%AB%99%E8%82%A5%E9%B1%BC%E6%88%90%E7%81%BE%2CAI%E8%AF%84%E8%AE%BA%E6%B3%9B%E6%BB%A5&topic_id=28368005"},{"crawl_count":3,"first_crawl_time":"2026-10-25T03:44:05+08:00","id":"11718c88ab82a10a4745a5f0","last_crawl_time":"2026-10-25T07:06:38+08:00","platform":"华尔街见闻","platform_id":"wallstreetcn-hot","rank":3,"rank_change":1,"ref":"N3","title":"亚马逊CEO：AI业务年化收入超250亿美元，增速是AWS初期的数百倍，砸2200亿美元仍无法满足需求","url":"https://wallstreetcn.com/articles/3784391"},{"crawl_count":2,"first_crawl_time":"2026-10-25T03:44:05+08:00","id":"7c66b4da8b8747dfe1ee4dcf","last_crawl_time":"2026-10-25T05:50:07+08:00","platform":"华尔街见闻","platform_id":"wallstreetcn-hot","rank":3,"rank_change":0,"ref":"N4","title":"油价飙升引发通胀忧虑，美股美债双双承压，苹果市值一度超英伟达，黄金周跌4%","url":"https://wallstreetcn.com/articles/3784279"},{"crawl_count":3,"first_crawl_time":"2026-10-25T03:44:05+08:00","id":"639baabcef193b61145c5a57","last_crawl_time":"2026-10-25T07:06:38+08:00","platform":"财联社热门","platform_id":"cls-hot","rank":4,"rank_change":-1,"ref":"N5","title":"又一AI医药“卖水人”股价新高：干湿闭环后 产业迈向下一命题","url":"https://www.cls.cn/detail/2513560"},{"crawl_count":3,"first_crawl_time":"2026-10-25T03:44:05+08:00","id":"5f12693ab098c8bef2fbfada","last_crawl_time":"2026-10-25T07:06:38+08:00","platform":"华尔街见闻","platform_id":"wallstreetcn-hot","rank":4,"rank_change":1,"ref":"N6","title":"“共识交易”的瓦解和新共识的诞生！高盛解答：为何机构当下都在大幅减仓AI","url":"https://wallstreetcn.com/articles/3784388"},{"crawl_count":3,"first_crawl_time":"2026-10-25T03:44:05+08:00","id":"8c0979dcc1849ddb8666e9b0","last_crawl_time":"2026-10-25T07:06:38+08:00","platform":"澎湃新闻","platform_id":"thepaper","rank":6,"rank_change":0,"ref":"N7","title":"当AI开始写代码，还需要什么样的程序员？","url":"https://www.thepaper.cn/newsDetail_forward_34225156"},{"crawl_count":3,"first_crawl_time":"2026-10-25T03:44:05+08:00","id":"e088d03f056ba953ef0ec622","last_crawl_time":"2026-10-25T07:06:38+08:00","platform":"华尔街见闻","platform_id":"wallstreetcn-hot","rank":6,"rank_change":1,"ref":"N8","title":"38美元，DeepSeek算了一笔赚钱的账","url":"https://wallstreetcn.com/articles/3784386"},{"crawl_count":3,"first_crawl_time":"2026-10-25T03:44:05+08:00","id":"37d9c5f9beacd17b2c8c968f","last_crawl_time":"2026-10-25T07:06:38+08:00","platform":"财联社热门","platform_id":"cls-hot","rank":8,"rank_change":1,"ref":"N9","title":"“黑色十月”席卷全球互联网！AI正彻底掀翻网络安全牌桌？","url":"https://www.cls.cn/detail/2514247"},{"crawl_count":3,"first_crawl_time":"2026-10-25T03:44:05+08:00","id":"df4e8cc079218339f77f90a8","last_crawl_time":"2026-10-25T07:06:38+08:00","platform":"华尔街见闻","platform_id":"wallstreetcn-hot","rank":8,"rank_change":1,"ref":"N10","title":"警告“下调评级”数据中心，标普要给AI债务危机“火上浇油”","url":"https://wallstreetcn.com/articles/3784379"},{"crawl_count":3,"first_crawl_time":"2026-10-25T03:44:05+08:00","id":"33254e27fac1878b5f1ee1f9","last_crawl_time":"2026-10-25T07:06:38+08:00","platform":"知乎","platform_id":"zhihu","rank":8,"rank_change":-7,"ref":"N11","title":"国务院办公厅称要「有效减缓人工智能应用就业替代影响」，释放出什么信号？可能带来哪些实际影响？","url":"https://www.zhihu.com/question/2097043375547536464"},{"crawl_count":3,"first_crawl_time":"2026-10-25T03:44:05+08:00","id":"48d076a4858955e6de117a18","last_crawl_time":"2026-10-25T07:06:38+08:00","platform":"华尔街见闻","platform_id":"wallstreetcn-hot","rank":9,"rank_change":1,"ref":"N12","title":"从“稳赚不赔”到“两害相权”，AI投资逻辑彻底变了！","url":"https://wallstreetcn.com/articles/3784381"},{"crawl_count":1,"first_crawl_time":"2026-10-25T07:06:38+08:00","id":"46423b9136d443446d039fae","last_crawl_time":"2026-10-25T07:06:38+08:00","platform":"华尔街见闻","platform_id":"wallstreetcn-hot","rank":10,"rank_change":0,"ref":"N13","title":"AI交易崩盘，Anthropic会推迟\"超级IPO\"吗？距离11月中旬\"预定上市日期\"不远了","url":"https://wallstreetcn.com/articles/3784380"},{"crawl_count":2,"first_crawl_time":"2026-10-25T05:50:07+08:00","id":"36ccc89caaa92dc4237f5e85","last_crawl_time":"2026-10-25T07:06:38+08:00","platform":"知乎","platform_id":"zhihu","rank":10,"rank_change":2,"ref":"N14","title":"为什么 chatgpt 和 claude 防不住蒸馏？","url":"https://www.zhihu.com/question/2097291551575749628"},{"crawl_count":3,"first_crawl_time":"2026-10-25T03:44:05+08:00","id":"e091fc8f7d85d0a5419fd957","last_crawl_time":"2026-10-25T07:06:38+08:00","platform":"财联社热门","platform_id":"cls-hot","rank":11,"rank_change":0,"ref":"N15","title":"OpenAI、Anthropic齐参与！全球首个AI生物安全实验室将问世","url":"https://www.cls.cn/detail/2514203"},{"crawl_count":3,"first_crawl_time":"2026-10-25T03:44:05+08:00","id":"df19076f4050e99025d7b1cd","last_crawl_time":"2026-10-25T07:06:38+08:00","platform":"财联社热门","platform_id":"cls-hot","rank":12,"rank_change":0,"ref":"N16","title":"“AI缺钱”重构产业叙事 市场不再相信“烧钱就能赢”","url":"https://www.cls.cn/detail/2513542"},{"crawl_count":1,"first_crawl_time":"2026-10-25T03:44:05+08:00","id":"00681a52b2253096bf6cd5ec","last_crawl_time":"2026-10-25T03:44:05+08:00","platform":"知乎","platform_id":"zhihu","rank":12,"rank_change":0,"ref":"N17","title":"宇树机器人侧空翻表演时甩断腿，问题可能出在哪里？出现这种情况正常吗？","url":"https://www.zhihu.com/question/2097252062257832354"},{"crawl_count":3,"first_crawl_time":"2026-10-25T03:44:05+08:00","id":"b409dab9a77f0e0460e89e11","last_crawl_time":"2026-10-25T07:06:38+08:00","platform":"贴吧","platform_id":"tieba","rank":26,"rank_change":0,"ref":"N18","title":"曝DeepSeek完成千亿融资","url":"https://tieba.baidu.com/hottopic/browse/hottopic?amp%3Btopic_name=%E6%9B%9DDeepSeek%E5%AE%8C%E6%88%90%E5%8D%83%E4%BA%BF%E8%9E%8D%E8%B5%84&topic_id=28367960"},{"crawl_count":1,"first_crawl_time":"2026-10-25T05:50:07+08:00","id":"9a38c22dff6e0e8c0edb692d","last_crawl_time":"2026-10-25T05:50:07+08:00","platform":"百度热搜","platform_id":"baidu","rank":29,"rank_change":0,"ref":"N19","title":"智元机器人创造吉尼斯世界纪录","url":"https://www.baidu.com/s?wd=%E6%99%BA%E5%85%83%E6%9C%BA%E5%99%A8%E4%BA%BA%E5%88%9B%E9%80%A0%E5%90%89%E5%B0%BC%E6%96%AF%E4%B8%96%E7%95%8C%E7%BA%AA%E5%BD%95"}],"warnings":[],"window_end":"2026-10-25T07:07:20+08:00","window_start":"2026-10-24T07:07:20+08:00"}
