{"aihot_items":[],"counts":{"aihot_published":0,"aihot_upstream":0,"trendradar_matched":15,"trendradar_published":15,"trendradar_raw":324},"generated_at":"2026-08-21T06:56:38+08:00","report_date":"2026-08-21","run_id":"20260821T065638+0800","schema_version":1,"source_status":{"aihot":{"api_version":null,"page_count":0,"status":"incomplete"},"trendradar":{"platform_count":11,"snapshot_count":3,"status":"live"}},"timezone":"Asia/Shanghai","trendradar_items":[{"crawl_count":3,"first_crawl_time":"2026-08-21T01:01:05+08:00","id":"6f09ef4bb3d7464902c27665","last_crawl_time":"2026-08-21T06:55:56+08:00","platform":"财联社热门","platform_id":"cls-hot","rank":2,"rank_change":2,"ref":"N1","title":"Meta被曝每周消耗数万亿Token 悄然成为微软AI大客户","url":"https://www.cls.cn/detail/2459905"},{"crawl_count":3,"first_crawl_time":"2026-08-21T01:01:05+08:00","id":"698cbcc61107b27cc67bec39","last_crawl_time":"2026-08-21T06:55:56+08:00","platform":"微博","platform_id":"weibo","rank":3,"rank_change":0,"ref":"N2","title":"中国铁路加速驶入AI赋能新阶段","url":"https://s.weibo.com/weibo?q=%23%E4%B8%AD%E5%9B%BD%E9%93%81%E8%B7%AF%E5%8A%A0%E9%80%9F%E9%A9%B6%E5%85%A5AI%E8%B5%8B%E8%83%BD%E6%96%B0%E9%98%B6%E6%AE%B5%23"},{"crawl_count":2,"first_crawl_time":"2026-08-21T01:01:05+08:00","id":"c3d5e623fc1314f54db50ccb","last_crawl_time":"2026-08-21T04:15:40+08:00","platform":"华尔街见闻","platform_id":"wallstreetcn-hot","rank":4,"rank_change":1,"ref":"N3","title":"美联储会议纪要偏鹰：7月加息阵营不止三人，多人认为若通胀不降需行动，部分料AI推升通胀","url":"https://wallstreetcn.com/articles/3779834"},{"crawl_count":3,"first_crawl_time":"2026-08-21T01:01:05+08:00","id":"5f8c0ffdb1c1a796d13e6aba","last_crawl_time":"2026-08-21T06:55:56+08:00","platform":"抖音","platform_id":"douyin","rank":5,"rank_change":0,"ref":"N4","title":"AI补全了我对长辈的所有未知","url":"https://www.douyin.com/hot/2617078"},{"crawl_count":3,"first_crawl_time":"2026-08-21T01:01:05+08:00","id":"dd39064ad52caef49897ae32","last_crawl_time":"2026-08-21T06:55:56+08:00","platform":"华尔街见闻","platform_id":"wallstreetcn-hot","rank":6,"rank_change":3,"ref":"N5","title":"阿里Q2营收同比增9%略超预期，AI基础设施投入推高资本开支，自由现金流净流出扩大至447亿元｜财报见闻","url":"https://wallstreetcn.com/articles/3779898"},{"crawl_count":2,"first_crawl_time":"2026-08-21T04:15:40+08:00","id":"81ca3504b6f344cb2db1bfc1","last_crawl_time":"2026-08-21T06:55:56+08:00","platform":"知乎","platform_id":"zhihu","rank":7,"rank_change":11,"ref":"N6","title":"Deepseek 涨价了，有哪些便宜的替代方案？","url":"https://www.zhihu.com/question/2072733800774354696"},{"crawl_count":1,"first_crawl_time":"2026-08-21T06:55:56+08:00","id":"812d1fbd8ee8668630a0f3e3","last_crawl_time":"2026-08-21T06:55:56+08:00","platform":"华尔街见闻","platform_id":"wallstreetcn-hot","rank":9,"rank_change":0,"ref":"N7","title":"阿里电话会：AI相关产品ARR突破495亿，平头哥芯片下半年将持续放量，Capex投入预计三年内回本","url":"https://wallstreetcn.com/articles/3779910"},{"crawl_count":3,"first_crawl_time":"2026-08-21T01:01:05+08:00","id":"8f1a286135f59a26b4a05a03","last_crawl_time":"2026-08-21T06:55:56+08:00","platform":"澎湃新闻","platform_id":"thepaper","rank":10,"rank_change":-2,"ref":"N8","title":"观察丨机器人越来越会干活了，为什么大家还是爱看“打架”和跳舞","url":"https://www.thepaper.cn/newsDetail_forward_33813225"},{"crawl_count":1,"first_crawl_time":"2026-08-21T06:55:56+08:00","id":"11b1d0dbcb953029124dcafd","last_crawl_time":"2026-08-21T06:55:56+08:00","platform":"华尔街见闻","platform_id":"wallstreetcn-hot","rank":10,"rank_change":0,"ref":"N9","title":"英伟达、SK海力士：必须拿下CPO！","url":"https://wallstreetcn.com/articles/3779909"},{"crawl_count":1,"first_crawl_time":"2026-08-21T06:55:56+08:00","id":"87bb5be0da74c8b116a5c830","last_crawl_time":"2026-08-21T06:55:56+08:00","platform":"bilibili 热搜","platform_id":"bilibili-hot-search","rank":12,"rank_change":0,"ref":"N10","title":"UP主用AI自制家庭史书APP","url":"https://search.bilibili.com/all?keyword=UP%E4%B8%BB%E7%94%A8AI%E8%87%AA%E5%88%B6%E5%AE%B6%E5%BA%AD%E5%8F%B2%E4%B9%A6APP"},{"crawl_count":3,"first_crawl_time":"2026-08-21T01:01:05+08:00","id":"2d4ad0a2b91be1eb02884855","last_crawl_time":"2026-08-21T06:55:56+08:00","platform":"知乎","platform_id":"zhihu","rank":12,"rank_change":-1,"ref":"N11","title":"如何看待 8 月 19 日下午 DeepSeek 被曝再次开始灰度测试，能力超过上次灰测？","url":"https://www.zhihu.com/question/2073476043097359622"},{"crawl_count":3,"first_crawl_time":"2026-08-21T01:01:05+08:00","id":"0f7553e90a74c54772894ae9","last_crawl_time":"2026-08-21T06:55:56+08:00","platform":"抖音","platform_id":"douyin","rank":23,"rank_change":2,"ref":"N12","title":"机器人跑出凌波微步既视感","url":"https://www.douyin.com/hot/2616835"},{"crawl_count":3,"first_crawl_time":"2026-08-21T01:01:05+08:00","id":"b996df65151fa2836341f4ba","last_crawl_time":"2026-08-21T06:55:56+08:00","platform":"贴吧","platform_id":"tieba","rank":23,"rank_change":0,"ref":"N13","title":"饭碗要凉,AI作者录屏自证手搓","url":"https://tieba.baidu.com/hottopic/browse/hottopic?amp%3Btopic_name=%E9%A5%AD%E7%A2%97%E8%A6%81%E5%87%89%2CAI%E4%BD%9C%E8%80%85%E5%BD%95%E5%B1%8F%E8%87%AA%E8%AF%81%E6%89%8B%E6%90%93&topic_id=28359015"},{"crawl_count":2,"first_crawl_time":"2026-08-21T01:01:05+08:00","id":"7a15565c1eb226fbd32d78ee","last_crawl_time":"2026-08-21T04:15:40+08:00","platform":"今日头条","platform_id":"toutiao","rank":25,"rank_change":-5,"ref":"N14","title":"机器马亮相世界机器人大会","url":"https://www.toutiao.com/trending/7675646269533601811/"},{"crawl_count":2,"first_crawl_time":"2026-08-21T01:01:05+08:00","id":"4fbfc0e1741880b8cf267f19","last_crawl_time":"2026-08-21T06:55:56+08:00","platform":"今日头条","platform_id":"toutiao","rank":30,"rank_change":-3,"ref":"N15","title":"AI助力治愈癌症 创新药牛市来了吗","url":"https://www.toutiao.com/trending/7676097469440069158/"}],"warnings":["aihot_source_incomplete"],"window_end":"2026-08-21T06:56:38+08:00","window_start":"2026-08-20T06:56:38+08:00"}
