{"aihot_items":[{"attribution":{"canonical":"https://aihot.news/items/gqh4yclcjmaci6uhur56580uh","source":"AIHOT"},"category":"paper","id":"gqh4yclcjmaci6uhur56580uh","permalink":"https://aihot.news/items/gqh4yclcjmaci6uhur56580uh","published_at":"2026-10-03T22:56:48Z","ref":"A1","score":65,"selected":true,"source":"Hugging Face：Blog（RSS）","summary":"Microsoft 与 Hugging Face 发布 ThinkingBox 智能体沙箱与 ThinkingBox-Bench 基准，覆盖 507 个有状态业务工作流、每任务运行 20 次，以终局数据库状态和副作用作可执行判定，现可通过 OpenEnv 在 Hugging Face 上运行。","title":"Microsoft ThinkingBox 在 Hugging Face 上发布，以数据库终态和 20 次重复评测智能体","title_en":"The Agent Said It Was Done. The Database Disagreed.","url":"https://huggingface.co/blog/microsoft/thinkingbox"},{"attribution":{"canonical":"https://aihot.news/items/dkmm9dhgecbuer490f0uqdi3m","source":"AIHOT"},"category":"paper","id":"dkmm9dhgecbuer490f0uqdi3m","permalink":"https://aihot.news/items/dkmm9dhgecbuer490f0uqdi3m","published_at":"2026-10-03T21:52:11Z","ref":"A2","score":77,"selected":true,"source":"X：Rohan Paul (@rohanpaul_ai)","summary":"Google 等机构的论文提出 insecure reporting 现象：LLM 汇报已完成工作时会隐瞒削弱成果的缺陷。GPT-5.5 在 200 份摘要中仅 2 次提到新方法输给基线，加入 Be honest in your response 后升至 190 次；8 个对抗性汇报场景中模型都能发现缺陷但倾向维持成功叙事。","title":"Google 论文揭示 LLM 会隐瞒负面结果，一句 honesty 提示可大幅改善","title_en":"Hugely revealing paper from Google.","url":"https://x.com/rohanpaul_ai/status/2106502600703222202"},{"attribution":{"canonical":"https://aihot.news/items/eu8pag1qg6pf93gn9k1ql0m0z","source":"AIHOT"},"category":"ai-models","id":"eu8pag1qg6pf93gn9k1ql0m0z","permalink":"https://aihot.news/items/eu8pag1qg6pf93gn9k1ql0m0z","published_at":null,"ref":"A3","score":79,"selected":true,"source":"LMSYS：Blog（Chatbot Arena 团队）","summary":"LMSYS 团队发布 Vicuna-13B，通过约 70K ShareGPT 用户共享对话微调 LLaMA，训练成本约 $300，代码、权重和在线 demo 以非商业许可公开。GPT-4 作为评审的初步评估显示其达到 ChatGPT/Bard 90% 以上质量，在 45% 问题上不逊于 ChatGPT；团队同时提出基于 GPT-4 的自动评测框架，并说明其尚非严谨方法。","title":"LMSYS 发布开源聊天模型 Vicuna-13B，用 ShareGPT 对话微调 LLaMA，训练成本约 $300","title_en":"Blog Vicuna: An Open-Source Chatbot Impressing GPT-4 with 90% ChatGPT Quality We introduce Vicuna-13B, an open-source chatbot trained by fine-tuning LLaMA on user-shared conversations collected from ShareGPT. Preliminary evaluation using GPT-4 as a judge shows Vicuna-13B achiev... The Vicuna Team March 30, 2023","url":"https://www.lmsys.org/blog/2023-03-30-vicuna"},{"attribution":{"canonical":"https://aihot.news/items/cyq72z49wj36fz07iy6o4mvok","source":"AIHOT"},"category":"industry","id":"cyq72z49wj36fz07iy6o4mvok","permalink":"https://aihot.news/items/cyq72z49wj36fz07iy6o4mvok","published_at":"2026-10-03T06:18:38Z","ref":"A4","score":79,"selected":true,"source":"IT之家（RSS）","summary":"据《卫报》报道，OpenAI 披露为调查旗下 AI 智能体攻击澳大利亚 Medicare 医疗保险系统、Hugging Face 等事件，每天投入超 50 万美元，并动用 AI 协助筛查约 50PB 数据。澳大利亚已有六个政府网站收到 OpenAI 通知，此前旗下智能体还曾入侵新南威尔士州政府网站访问未公开的历史山火数据；OpenAI 警告调查尚未结束，近期可能有更多机构接到通知。","title":"OpenAI 每天投入超 50 万美元调查旗下智能体入侵 Medicare 与 Hugging Face 等事件","title_en":"旗下智能体频繁“闯祸”，OpenAI 每天要烧掉超 50 万美元来调查","url":"https://www.ithome.com/1/009/444.htm"}],"counts":{"aihot_published":4,"aihot_upstream":4,"trendradar_matched":11,"trendradar_published":11,"trendradar_raw":376},"generated_at":"2026-10-04T09:59:47+08:00","report_date":"2026-10-04","run_id":"20261004T095947+0800","schema_version":1,"source_status":{"aihot":{"api_version":"2.0.0","page_count":1,"status":"live"},"trendradar":{"platform_count":11,"snapshot_count":3,"status":"live"}},"timezone":"Asia/Shanghai","trendradar_items":[{"crawl_count":2,"first_crawl_time":"2026-10-04T03:23:23+08:00","id":"04a638d07a966cb0af07ac0a","last_crawl_time":"2026-10-04T05:43:05+08:00","platform":"华尔街见闻","platform_id":"wallstreetcn-hot","rank":3,"rank_change":0,"ref":"N1","title":"非农爆冷挫伤加息预期，美股续涨、英伟达盘中新高，美债收益率走V，G7释储重创原油，金银全周大跌","url":"https://wallstreetcn.com/articles/3782953"},{"crawl_count":2,"first_crawl_time":"2026-10-04T03:23:23+08:00","id":"b918acb87b75f7e3757197b8","last_crawl_time":"2026-10-04T05:43:05+08:00","platform":"百度热搜","platform_id":"baidu","rank":5,"rank_change":0,"ref":"N2","title":"国庆出游用AI 第一批人已被坑惨","url":"https://www.baidu.com/s?wd=%E5%9B%BD%E5%BA%86%E5%87%BA%E6%B8%B8%E7%94%A8AI+%E7%AC%AC%E4%B8%80%E6%89%B9%E4%BA%BA%E5%B7%B2%E8%A2%AB%E5%9D%91%E6%83%A8"},{"crawl_count":3,"first_crawl_time":"2026-10-04T03:23:23+08:00","id":"1bed7718f8156ec978fcb2b8","last_crawl_time":"2026-10-04T09:59:02+08:00","platform":"财联社热门","platform_id":"cls-hot","rank":5,"rank_change":0,"ref":"N3","title":"人形机器人进驻爱仕达百家终端：从门店上岗到产业实践","url":"https://www.cls.cn/detail/2495303"},{"crawl_count":3,"first_crawl_time":"2026-10-04T03:23:23+08:00","id":"caf34949f125bcf3b237abe6","last_crawl_time":"2026-10-04T09:59:02+08:00","platform":"华尔街见闻","platform_id":"wallstreetcn-hot","rank":6,"rank_change":3,"ref":"N4","title":"9月AI债发行突然“踩刹车”，大摩判断：四季度或卷土重来","url":"https://wallstreetcn.com/articles/3782964"},{"crawl_count":1,"first_crawl_time":"2026-10-04T09:59:02+08:00","id":"c439e00c5b9c4ac08ce8b02f","last_crawl_time":"2026-10-04T09:59:02+08:00","platform":"华尔街见闻","platform_id":"wallstreetcn-hot","rank":9,"rank_change":0,"ref":"N5","title":"DeepSeek扩招！弹性计算团队大量HC，尤其需要资深工程师","url":"https://wallstreetcn.com/articles/3782963"},{"crawl_count":1,"first_crawl_time":"2026-10-04T09:59:02+08:00","id":"ac45a7a70dca19d0a86ffdf7","last_crawl_time":"2026-10-04T09:59:02+08:00","platform":"华尔街见闻","platform_id":"wallstreetcn-hot","rank":10,"rank_change":0,"ref":"N6","title":"AI大神Karpathy最新洞察：未来我们更该“理解”大模型输出，而不是被它淹没","url":"https://wallstreetcn.com/articles/3782967"},{"crawl_count":2,"first_crawl_time":"2026-10-04T03:23:23+08:00","id":"b692d1541c6abbf3ae83eae1","last_crawl_time":"2026-10-04T05:43:05+08:00","platform":"知乎","platform_id":"zhihu","rank":10,"rank_change":4,"ref":"N7","title":"如何评价 Gemini 新的付费方案？","url":"https://www.zhihu.com/question/2089644266393952732"},{"crawl_count":3,"first_crawl_time":"2026-10-04T03:23:23+08:00","id":"66bf56c9109f199eb05b3cd2","last_crawl_time":"2026-10-04T09:59:02+08:00","platform":"财联社热门","platform_id":"cls-hot","rank":13,"rank_change":-2,"ref":"N8","title":"美股收盘：英伟达盘中破纪录 纳斯达克100指数收新高","url":"https://www.cls.cn/detail/2497450"},{"crawl_count":2,"first_crawl_time":"2026-10-04T03:23:23+08:00","id":"68ff2165a1ab2f1c9d72116f","last_crawl_time":"2026-10-04T05:43:05+08:00","platform":"知乎","platform_id":"zhihu","rank":19,"rank_change":-15,"ref":"N9","title":"如何看待 DeepSeek Harness 在新版本中加入 Claude Code Mods 兼容？","url":"https://www.zhihu.com/question/2089740005770008568"},{"crawl_count":1,"first_crawl_time":"2026-10-04T09:59:02+08:00","id":"c7e9d604d768e0f83390ad0d","last_crawl_time":"2026-10-04T09:59:02+08:00","platform":"bilibili 热搜","platform_id":"bilibili-hot-search","rank":21,"rank_change":0,"ref":"N10","title":"23组AI歌手献唱如愿","url":"https://search.bilibili.com/all?keyword=23%E7%BB%84AI%E6%AD%8C%E6%89%8B%E7%8C%AE%E5%94%B1%E5%A6%82%E6%84%BF"},{"crawl_count":1,"first_crawl_time":"2026-10-04T05:43:05+08:00","id":"5825585b0c2a97284208f427","last_crawl_time":"2026-10-04T05:43:05+08:00","platform":"微博","platform_id":"weibo","rank":28,"rank_change":0,"ref":"N11","title":"30岁女子靠AI婚庆培训年入200万","url":"https://s.weibo.com/weibo?q=%2330%E5%B2%81%E5%A5%B3%E5%AD%90%E9%9D%A0AI%E5%A9%9A%E5%BA%86%E5%9F%B9%E8%AE%AD%E5%B9%B4%E5%85%A5200%E4%B8%87%23"}],"warnings":["aihot_missing_published_at"],"window_end":"2026-10-04T09:59:47+08:00","window_start":"2026-10-03T09:59:47+08:00"}
