{"aihot_items":[{"attribution":{"canonical":"https://aihot.news/items/cmu06l0dg09hiroryn5e19xp1","source":"AIHOT"},"category":"tip","id":"cmu06l0dg09hiroryn5e19xp1","permalink":"https://aihot.news/items/cmu06l0dg09hiroryn5e19xp1","published_at":"2026-09-13T18:34:31Z","ref":"A1","score":62,"selected":true,"source":"Gary Marcus：The Road to AI We Can Trust（RSS）","summary":"Gary Marcus 评析 Dario Amodei 倡导放慢 AI 发展并支持透明度的文章，Sam Altman 与 Elon Musk 迅速表示认同。Marcus 肯定其透明度承诺，但列举多方质疑：METR 与 AI 公司关系过近、Anthropic 借对华威胁维持加速、以及该提议可能意在抢先于真正的监管。","title":"Gary Marcus 评 Dario Amodei 的放慢 AI 发展提议：三份赞誉加两分怀疑","title_en":"Two cheers （out of three） for Dario Amodei","url":"https://garymarcus.substack.com/p/two-cheers-out-of-three-for-dario"},{"attribution":{"canonical":"https://aihot.news/items/cmu01iavi08reroymepsxnar2","source":"AIHOT"},"category":"industry","id":"cmu01iavi08reroymepsxnar2","permalink":"https://aihot.news/items/cmu01iavi08reroymepsxnar2","published_at":"2026-09-13T14:15:40Z","ref":"A2","score":85,"selected":true,"source":"Hacker News：AI 热帖","summary":"Anthropic 9 月威胁报告披露，据评估极可能关联胡塞组织的也门小组使用 Claude Code 开发制导火箭、射程超 2，000 公里弹道导弹及名为 R2000 的高超声速滑翔载具概念的相关软件。","title":"Anthropic 报告称胡塞组织用 Claude Code 开发导弹制导软件","title_en":"Houthis Used Claude Code to Develop Missile Guidance Software： Anthropic","url":"https://clashreport.com/world/articles/houthis-used-claude-code-to-develop-missile-guidance-software-anthropic-s52mnx4pwpo"},{"attribution":{"canonical":"https://aihot.news/items/cmtzezuk0077wrowyi7a4qy7v","source":"AIHOT"},"category":"tip","id":"cmtzezuk0077wrowyi7a4qy7v","permalink":"https://aihot.news/items/cmtzezuk0077wrowyi7a4qy7v","published_at":"2026-09-13T05:56:03Z","ref":"A3","score":78,"selected":true,"source":"MarkTechPost（RSS）","summary":"文章解析 Agent harness 层应对长任务中上下文溢出与目标丢失的四类机制：上下文预算与卸载、压缩、todo-state 复述和跨会话记忆。","title":"Agent 长任务上下文工程解析：用预算控制、压缩、todo-state 和记忆对抗上下文溢出与目标丢失","title_en":"Context Engineering Inside the Harness： 4 Mechanisms That Beat Context Overflow and Goal Loss on Long-Horizon Tasks","url":"https://www.marktechpost.com/2026/09/12/context-engineering-inside-the-harness-4-mechanisms-that-beat-context-overflow-and-goal-loss-on-long-horizon-tasks"},{"attribution":{"canonical":"https://aihot.news/items/cmtyuqztw0bk6roupjaey0f6w","source":"AIHOT"},"category":"tip","id":"cmtyuqztw0bk6roupjaey0f6w","permalink":"https://aihot.news/items/cmtyuqztw0bk6roupjaey0f6w","published_at":"2026-09-12T20:18:42Z","ref":"A4","score":70,"selected":true,"source":"X：Peter McCrory（Anthropic 首席经济学家，@PeterMcCrory）","summary":"Dario Amodei 发布新文章 We Must Pace the Frontier，主张 AI 行业应放慢速度，并提出三部分计划。Anthropic 单方面承诺第一步，为第三方评估者提供永久的员工级系统访问权限，以核实安全措施执行、报告事故并评估训练期间模型的 alignment。","title":"Dario Amodei 发文呼吁 AI 行业放慢前沿速度并公布三步计划","title_en":"Please read this essay. The transformative potential of AI to bring immense benefits to the world r…","url":"https://x.com/PeterMcCrory/status/2098868931071226252"},{"attribution":{"canonical":"https://aihot.news/items/cmtyth87f098broupl3k186iw","source":"AIHOT"},"category":"tip","id":"cmtyth87f098broupl3k186iw","permalink":"https://aihot.news/items/cmtyth87f098broupl3k186iw","published_at":"2026-09-12T19:46:58Z","ref":"A5","score":71,"selected":true,"source":"X：Thariq (@trq212)","summary":"Anthropic 的 Thariq 转发并支持 Dario Amodei 的新文章《We Must Pace the Frontier》，后者提出 AI 行业应放缓的三部分计划，并承诺向第三方评估者提供永久的员工级系统访问权限。","title":"Thariq 支持 Dario Amodei 的放缓前沿 AI 倡议，呼吁给系统加固和社会讨论留出时间","title_en":"If you showed me Claude Code today in 2018， I would have thought it was AGI. We have already absorb…","url":"https://x.com/trq212/status/2098860941391872132"}],"counts":{"aihot_published":5,"aihot_upstream":5,"trendradar_matched":17,"trendradar_published":17,"trendradar_raw":255},"generated_at":"2026-09-14T03:44:33+08:00","report_date":"2026-09-14","run_id":"20260914T034433+0800","schema_version":1,"source_status":{"aihot":{"api_version":"1.8.0","page_count":1,"status":"live"},"trendradar":{"platform_count":11,"snapshot_count":1,"status":"live"}},"timezone":"Asia/Shanghai","trendradar_items":[{"crawl_count":1,"first_crawl_time":"2026-09-14T03:43:51+08:00","id":"b1405e6c5967ee452f7e9d9e","last_crawl_time":"2026-09-14T03:43:51+08:00","platform":"华尔街见闻","platform_id":"wallstreetcn-hot","rank":1,"rank_change":0,"ref":"N1","title":"死敌罕见联手！马斯克、Altman支持Dario Amodei“全球放缓AI”呼吁","url":"https://wallstreetcn.com/articles/3781639"},{"crawl_count":1,"first_crawl_time":"2026-09-14T03:43:51+08:00","id":"558e873140644d6bdabe3064","last_crawl_time":"2026-09-14T03:43:51+08:00","platform":"bilibili 热搜","platform_id":"bilibili-hot-search","rank":2,"rank_change":0,"ref":"N2","title":"AI正成为危险是危言耸听吗","url":"https://search.bilibili.com/all?keyword=AI%E6%AD%A3%E6%88%90%E4%B8%BA%E5%8D%B1%E9%99%A9%E6%98%AF%E5%8D%B1%E8%A8%80%E8%80%B8%E5%90%AC%E5%90%97"},{"crawl_count":1,"first_crawl_time":"2026-09-14T03:43:51+08:00","id":"a8680a14cbc32a5f5112905e","last_crawl_time":"2026-09-14T03:43:51+08:00","platform":"华尔街见闻","platform_id":"wallstreetcn-hot","rank":2,"rank_change":0,"ref":"N3","title":"“AI交易”周一要遭暴击？三巨头支持“放缓”、OpenAI推迟IPO引热议","url":"https://wallstreetcn.com/articles/3781643"},{"crawl_count":1,"first_crawl_time":"2026-09-14T03:43:51+08:00","id":"2f26e0012c63f1c24896fbda","last_crawl_time":"2026-09-14T03:43:51+08:00","platform":"bilibili 热搜","platform_id":"bilibili-hot-search","rank":5,"rank_change":0,"ref":"N4","title":"AI会有数学创新能力吗","url":"https://search.bilibili.com/all?keyword=AI%E4%BC%9A%E6%9C%89%E6%95%B0%E5%AD%A6%E5%88%9B%E6%96%B0%E8%83%BD%E5%8A%9B%E5%90%97"},{"crawl_count":1,"first_crawl_time":"2026-09-14T03:43:51+08:00","id":"c2a3402549289889fa41a01f","last_crawl_time":"2026-09-14T03:43:51+08:00","platform":"华尔街见闻","platform_id":"wallstreetcn-hot","rank":5,"rank_change":0,"ref":"N5","title":"Altman“放话”：OpenAI今年不会IPO，如果AI威胁人类生存，宁愿毁掉IPO","url":"https://wallstreetcn.com/articles/3781638"},{"crawl_count":1,"first_crawl_time":"2026-09-14T03:43:51+08:00","id":"a2a09ac13b78eb898d3c53e7","last_crawl_time":"2026-09-14T03:43:51+08:00","platform":"财联社热门","platform_id":"cls-hot","rank":6,"rank_change":0,"ref":"N6","title":"国常会部署算力网建设，产业一线订单火热，算力调优付费意愿高","url":"https://www.cls.cn/detail/2481462"},{"crawl_count":1,"first_crawl_time":"2026-09-14T03:43:51+08:00","id":"fec80fd7e763381e8ce5bc7f","last_crawl_time":"2026-09-14T03:43:51+08:00","platform":"凤凰网","platform_id":"ifeng","rank":6,"rank_change":0,"ref":"N7","title":"“AI会在2030年前毁灭人类”，美AI巨头呼吁减速","url":"https://news.ifeng.com/c/8wNpWp6CJdN"},{"crawl_count":1,"first_crawl_time":"2026-09-14T03:43:51+08:00","id":"698358ebdeed980177f78c1f","last_crawl_time":"2026-09-14T03:43:51+08:00","platform":"财联社热门","platform_id":"cls-hot","rank":7,"rank_change":0,"ref":"N8","title":"【早报】我国词元消耗量今年将达到10亿亿；英伟达拟斥资100亿美元参投Anthropic IPO","url":"https://www.cls.cn/detail/2481566"},{"crawl_count":1,"first_crawl_time":"2026-09-14T03:43:51+08:00","id":"8afb1126585f95fc4b46f830","last_crawl_time":"2026-09-14T03:43:51+08:00","platform":"财联社热门","platform_id":"cls-hot","rank":8,"rank_change":0,"ref":"N9","title":"全国仅7省上架率超过75% “有效算力”成智算集群竞争重点|直击2026中国算力大会","url":"https://www.cls.cn/detail/2481579"},{"crawl_count":1,"first_crawl_time":"2026-09-14T03:43:51+08:00","id":"136437ce3eaf0ce417075792","last_crawl_time":"2026-09-14T03:43:51+08:00","platform":"抖音","platform_id":"douyin","rank":9,"rank_change":0,"ref":"N10","title":"AI巨头按下“IPO暂停键”","url":"https://www.douyin.com/hot/2648508"},{"crawl_count":1,"first_crawl_time":"2026-09-14T03:43:51+08:00","id":"cbcabeede8d23e831cc7690b","last_crawl_time":"2026-09-14T03:43:51+08:00","platform":"华尔街见闻","platform_id":"wallstreetcn-hot","rank":10,"rank_change":0,"ref":"N11","title":"我们距离RSI还有多远？来自AI一线的观点","url":"https://wallstreetcn.com/articles/3781652"},{"crawl_count":1,"first_crawl_time":"2026-09-14T03:43:51+08:00","id":"ee7afa4a74fe9324d9fc6069","last_crawl_time":"2026-09-14T03:43:51+08:00","platform":"知乎","platform_id":"zhihu","rank":11,"rank_change":0,"ref":"N12","title":"如何看待 Anthropic 、马斯克等顶级 AI 公司呼吁控制前沿 AI 发展节奏？为啥在此时喊减速？","url":"https://www.zhihu.com/question/2082571703062721521"},{"crawl_count":1,"first_crawl_time":"2026-09-14T03:43:51+08:00","id":"ba66468cf979d9f3630a5117","last_crawl_time":"2026-09-14T03:43:51+08:00","platform":"财联社热门","platform_id":"cls-hot","rank":12,"rank_change":0,"ref":"N13","title":"Anthropic掌门人呼吁放缓模型迭代 马斯克、奥尔特曼齐响应","url":"https://www.cls.cn/detail/2481555"},{"crawl_count":1,"first_crawl_time":"2026-09-14T03:43:51+08:00","id":"206185bc67bfb72abae02875","last_crawl_time":"2026-09-14T03:43:51+08:00","platform":"财联社热门","platform_id":"cls-hot","rank":13,"rank_change":0,"ref":"N14","title":"算力产业链下半场新变化：上游把“工地”搬进工厂，下游把算力当水电卖","url":"https://www.cls.cn/detail/2481510"},{"crawl_count":1,"first_crawl_time":"2026-09-14T03:43:51+08:00","id":"d27bd3780a01c4f6b1591be5","last_crawl_time":"2026-09-14T03:43:51+08:00","platform":"今日头条","platform_id":"toutiao","rank":17,"rank_change":0,"ref":"N15","title":"奥巴马：人工智能可能带来“危险”","url":"https://www.toutiao.com/trending/7684709617997709321/"},{"crawl_count":1,"first_crawl_time":"2026-09-14T03:43:51+08:00","id":"0e5ac0193848590f8eefcd6e","last_crawl_time":"2026-09-14T03:43:51+08:00","platform":"贴吧","platform_id":"tieba","rank":20,"rank_change":0,"ref":"N16","title":"AI抢饭碗,数学家急眼","url":"https://tieba.baidu.com/hottopic/browse/hottopic?amp%3Btopic_name=AI%E6%8A%A2%E9%A5%AD%E7%A2%97%2C%E6%95%B0%E5%AD%A6%E5%AE%B6%E6%80%A5%E7%9C%BC&topic_id=28363786"},{"crawl_count":1,"first_crawl_time":"2026-09-14T03:43:51+08:00","id":"0458a3dc22859540190b24cd","last_crawl_time":"2026-09-14T03:43:51+08:00","platform":"今日头条","platform_id":"toutiao","rank":28,"rank_change":0,"ref":"N17","title":"AI真正的问题是什么","url":"https://www.toutiao.com/trending/7685012598906965558/"}],"warnings":["trendradar_incomplete_slots"],"window_end":"2026-09-14T03:44:33+08:00","window_start":"2026-09-13T03:44:33+08:00"}
