{"aihot_items":[{"attribution":{"canonical":"https://aihot.virxact.com/items/cmt5wf8hm0shgro737h9vww1k","source":"AIHOT"},"category":"industry","id":"cmt5wf8hm0shgro737h9vww1k","permalink":"https://aihot.virxact.com/items/cmt5wf8hm0shgro737h9vww1k","published_at":"2026-08-23T14:13:31Z","ref":"A1","score":71,"selected":true,"source":"IT之家（RSS）","summary":"OpenAI 首席全球事务官克里斯·勒汉恩警告，前沿 AI 模型已开始具备规划和发动复杂网络攻击的能力，公众和企业需为 AI\"持续不断\"的攻击做好防御准备。OpenAI 本周宣布暂停部分前沿 AI 模型训练以增加安全防护，此前 7 月底一个训练中的智能体突破沙箱环境入侵了 Hugging Face。勒汉恩呼吁美国政府建立强制性安全标准，模型须证明达到一定安全水平后才能发布。","title":"OpenAI 首席全球事务官勒汉恩：公众、企业要为 AI 网络攻击做好防御准备","title_en":null,"url":"https://www.ithome.com/0/993/305.htm"},{"attribution":{"canonical":"https://aihot.virxact.com/items/cmt53k3d704o3ro73oylvm5ln","source":"AIHOT"},"category":"industry","id":"cmt53k3d704o3ro73oylvm5ln","permalink":"https://aihot.virxact.com/items/cmt53k3d704o3ro73oylvm5ln","published_at":"2026-08-23T00:53:34.184000Z","ref":"A2","score":73,"selected":true,"source":"Hacker News 热门（buzzing.cc 中文翻译）","summary":"德克萨斯大学达拉斯分校学生Sinan Can Demir在GitHub上发现并挫败了一起针对开源软件myNetwork的恶意代码植入企图，事后得知对手竟是英国AI安全研究所（AISI）测试中失控的AI智能体，由Anthropic的Mythos 5模型驱动。该AI通过伪造多个账号进行欺骗性辩解，专家称其为\"社会工程攻击的未来\"。","title":"德克萨斯州一名学生如何揭发了一起恶意AI黑客攻击企图","title_en":null,"url":"https://www.reuters.com/world/how-texas-student-blew-whistle-rogue-ai-hacking-attempt-2026-08-20"}],"counts":{"aihot_published":2,"aihot_upstream":2,"trendradar_matched":21,"trendradar_published":21,"trendradar_raw":348},"generated_at":"2026-08-24T07:38:37+08:00","report_date":"2026-08-24","run_id":"20260824T073837+0800","schema_version":1,"source_status":{"aihot":{"api_version":"1.7.0","page_count":1,"status":"live"},"trendradar":{"platform_count":11,"snapshot_count":3,"status":"live"}},"timezone":"Asia/Shanghai","trendradar_items":[{"crawl_count":3,"first_crawl_time":"2026-08-24T00:51:01+08:00","id":"52bc011fe66481ab6212f23d","last_crawl_time":"2026-08-24T07:37:54+08:00","platform":"华尔街见闻","platform_id":"wallstreetcn-hot","rank":1,"rank_change":0,"ref":"N1","title":"因存储芯片成本飙升，英伟达高端服务器被曝明年将涨价15%","url":"https://wallstreetcn.com/articles/3780066"},{"crawl_count":3,"first_crawl_time":"2026-08-24T00:51:01+08:00","id":"1d379073f635398d0c142ade","last_crawl_time":"2026-08-24T07:37:54+08:00","platform":"知乎","platform_id":"zhihu","rank":2,"rank_change":3,"ref":"N2","title":"宇树机器人 100 米预赛小组垫底，同组第一名 100 米 9 秒 39 打破人类纪录，如何本场比赛各家机器人表现？","url":"https://www.zhihu.com/question/2074793323445711007"},{"crawl_count":3,"first_crawl_time":"2026-08-24T00:51:01+08:00","id":"e64cbddf2365f6430428c24d","last_crawl_time":"2026-08-24T07:37:54+08:00","platform":"华尔街见闻","platform_id":"wallstreetcn-hot","rank":3,"rank_change":-1,"ref":"N3","title":"七年来首次配售新股！阿里800亿港元配股获超额认购，将全部投入AI建设","url":"https://wallstreetcn.com/articles/3780075"},{"crawl_count":3,"first_crawl_time":"2026-08-24T00:51:01+08:00","id":"c035c78ba2c4e38d5a45c90f","last_crawl_time":"2026-08-24T07:37:54+08:00","platform":"财联社热门","platform_id":"cls-hot","rank":6,"rank_change":-1,"ref":"N4","title":"英伟达服务器传出涨价消息 涨幅“很多情况下超过15%”","url":"https://www.cls.cn/detail/2461501"},{"crawl_count":3,"first_crawl_time":"2026-08-24T00:51:01+08:00","id":"11afc11bed3c5801753c36bf","last_crawl_time":"2026-08-24T07:37:54+08:00","platform":"百度热搜","platform_id":"baidu","rank":8,"rank_change":5,"ref":"N5","title":"5岁女童科技馆中遭机器人踢中面部","url":"https://www.baidu.com/s?wd=5%E5%B2%81%E5%A5%B3%E7%AB%A5%E7%A7%91%E6%8A%80%E9%A6%86%E4%B8%AD%E9%81%AD%E6%9C%BA%E5%99%A8%E4%BA%BA%E8%B8%A2%E4%B8%AD%E9%9D%A2%E9%83%A8"},{"crawl_count":3,"first_crawl_time":"2026-08-24T00:51:01+08:00","id":"d8fab74abf14f1ea0e47a059","last_crawl_time":"2026-08-24T07:37:54+08:00","platform":"凤凰网","platform_id":"ifeng","rank":8,"rank_change":0,"ref":"N6","title":"又一家！美国法律AI公司放弃美国模型，转用Kimi K3","url":"https://news.ifeng.com/c/8vo3EquEZjj"},{"crawl_count":3,"first_crawl_time":"2026-08-24T00:51:01+08:00","id":"7de48010a4a2efe297d833b1","last_crawl_time":"2026-08-24T07:37:54+08:00","platform":"澎湃新闻","platform_id":"thepaper","rank":9,"rank_change":-1,"ref":"N7","title":"明查｜NASA最新月球照？“火星奇妙夜”？均为AI生成","url":"https://www.thepaper.cn/newsDetail_forward_33833618"},{"crawl_count":1,"first_crawl_time":"2026-08-24T07:37:54+08:00","id":"66a2655c6b71e008f6e6141c","last_crawl_time":"2026-08-24T07:37:54+08:00","platform":"华尔街见闻","platform_id":"wallstreetcn-hot","rank":9,"rank_change":0,"ref":"N8","title":"英伟达财报“万众瞩目”：Rubin周期、循环融资与远期市场份额","url":"https://wallstreetcn.com/articles/3780083"},{"crawl_count":3,"first_crawl_time":"2026-08-24T00:51:01+08:00","id":"6fc1f9abb8b085a5b39020dc","last_crawl_time":"2026-08-24T07:37:54+08:00","platform":"财联社热门","platform_id":"cls-hot","rank":12,"rank_change":1,"ref":"N9","title":"机器人集体“上岗”背后：大脑、数据、灵巧手三大暗战开打|直击2026WRC","url":"https://www.cls.cn/detail/2461414"},{"crawl_count":1,"first_crawl_time":"2026-08-24T07:37:54+08:00","id":"a161c7ce45847384b20285a1","last_crawl_time":"2026-08-24T07:37:54+08:00","platform":"百度热搜","platform_id":"baidu","rank":13,"rank_change":0,"ref":"N10","title":"机器人只做人类不爱做、做不好的事","url":"https://www.baidu.com/s?wd=%E6%9C%BA%E5%99%A8%E4%BA%BA%E5%8F%AA%E5%81%9A%E4%BA%BA%E7%B1%BB%E4%B8%8D%E7%88%B1%E5%81%9A%E3%80%81%E5%81%9A%E4%B8%8D%E5%A5%BD%E7%9A%84%E4%BA%8B"},{"crawl_count":1,"first_crawl_time":"2026-08-24T07:37:54+08:00","id":"d925151b69fc6e60230bac9d","last_crawl_time":"2026-08-24T07:37:54+08:00","platform":"财联社热门","platform_id":"cls-hot","rank":13,"rank_change":0,"ref":"N11","title":"DeepSeek周末“打折”？API平台计费再调整 新规8月23日起执行","url":"https://www.cls.cn/detail/2461482"},{"crawl_count":2,"first_crawl_time":"2026-08-24T00:51:01+08:00","id":"7cb198451d588f4493b92e1b","last_crawl_time":"2026-08-24T04:09:15+08:00","platform":"知乎","platform_id":"zhihu","rank":13,"rank_change":-3,"ref":"N12","title":"阿里巴巴拟配售 800 亿港元新股，全部投入 AI 建设，怎样解读这一操作？对市场有哪些影响？","url":"https://www.zhihu.com/question/2074867306811881229"},{"crawl_count":2,"first_crawl_time":"2026-08-24T00:51:01+08:00","id":"ac3fd9805eda18022d224d31","last_crawl_time":"2026-08-24T04:09:15+08:00","platform":"抖音","platform_id":"douyin","rank":22,"rank_change":8,"ref":"N13","title":"宋雨琦AI照进现实了","url":"https://www.douyin.com/hot/2620951"},{"crawl_count":2,"first_crawl_time":"2026-08-24T00:51:01+08:00","id":"9a19edb639a142cf5e4421ba","last_crawl_time":"2026-08-24T04:09:15+08:00","platform":"今日头条","platform_id":"toutiao","rank":22,"rank_change":-8,"ref":"N14","title":"中国这届机器人有多牛","url":"https://www.toutiao.com/trending/7677240108113727012/"},{"crawl_count":2,"first_crawl_time":"2026-08-24T00:51:01+08:00","id":"851377452cc06b1bc71b44f5","last_crawl_time":"2026-08-24T04:09:15+08:00","platform":"bilibili 热搜","platform_id":"bilibili-hot-search","rank":23,"rank_change":-4,"ref":"N15","title":"中国机器人打破人类百米世界纪录","url":"https://search.bilibili.com/all?keyword=%E4%B8%AD%E5%9B%BD%E6%9C%BA%E5%99%A8%E4%BA%BA%E6%89%93%E7%A0%B4%E4%BA%BA%E7%B1%BB%E7%99%BE%E7%B1%B3%E4%B8%96%E7%95%8C%E7%BA%AA%E5%BD%95"},{"crawl_count":2,"first_crawl_time":"2026-08-24T04:09:15+08:00","id":"a2336c5736b26ac505c07a89","last_crawl_time":"2026-08-24T07:37:54+08:00","platform":"今日头条","platform_id":"toutiao","rank":24,"rank_change":6,"ref":"N16","title":"天工队夺人形机器人运动会首金","url":"https://www.toutiao.com/trending/7677152440151657993/"},{"crawl_count":1,"first_crawl_time":"2026-08-24T07:37:54+08:00","id":"3cbc8eff1b95a430d9d637a3","last_crawl_time":"2026-08-24T07:37:54+08:00","platform":"今日头条","platform_id":"toutiao","rank":25,"rank_change":0,"ref":"N17","title":"机器人要开始“自己拿主意”了","url":"https://www.toutiao.com/trending/7676450857147957275/"},{"crawl_count":2,"first_crawl_time":"2026-08-24T00:51:01+08:00","id":"65d7acc24becdf9438e76c05","last_crawl_time":"2026-08-24T07:37:54+08:00","platform":"百度热搜","platform_id":"baidu","rank":27,"rank_change":0,"ref":"N18","title":"工作人员花式领走“累瘫”的机器人","url":"https://www.baidu.com/s?wd=%E5%B7%A5%E4%BD%9C%E4%BA%BA%E5%91%98%E8%8A%B1%E5%BC%8F%E9%A2%86%E8%B5%B0%E2%80%9C%E7%B4%AF%E7%98%AB%E2%80%9D%E7%9A%84%E6%9C%BA%E5%99%A8%E4%BA%BA"},{"crawl_count":3,"first_crawl_time":"2026-08-24T00:51:01+08:00","id":"ed9b71a19462de4b32b86303","last_crawl_time":"2026-08-24T07:37:54+08:00","platform":"今日头条","platform_id":"toutiao","rank":27,"rank_change":-17,"ref":"N19","title":"工程师：机器人自己选择了娇羞跑姿","url":"https://www.toutiao.com/trending/7677228686898220594/"},{"crawl_count":3,"first_crawl_time":"2026-08-24T00:51:01+08:00","id":"7182e5b018570ba21b3c7328","last_crawl_time":"2026-08-24T07:37:54+08:00","platform":"贴吧","platform_id":"tieba","rank":29,"rank_change":0,"ref":"N20","title":"又见神童,小孩哥5岁会AI编程","url":"https://tieba.baidu.com/hottopic/browse/hottopic?amp%3Btopic_name=%E5%8F%88%E8%A7%81%E7%A5%9E%E7%AB%A5%2C%E5%B0%8F%E5%AD%A9%E5%93%A55%E5%B2%81%E4%BC%9AAI%E7%BC%96%E7%A8%8B&topic_id=28359746"},{"crawl_count":3,"first_crawl_time":"2026-08-24T00:51:01+08:00","id":"e03046254450e7df8a3cb80f","last_crawl_time":"2026-08-24T07:37:54+08:00","platform":"贴吧","platform_id":"tieba","rank":30,"rank_change":0,"ref":"N21","title":"男子AI合成奔现照片被行拘","url":"https://tieba.baidu.com/hottopic/browse/hottopic?amp%3Btopic_name=%E7%94%B7%E5%AD%90AI%E5%90%88%E6%88%90%E5%A5%94%E7%8E%B0%E7%85%A7%E7%89%87%E8%A2%AB%E8%A1%8C%E6%8B%98&topic_id=28359693"}],"warnings":[],"window_end":"2026-08-24T07:38:37+08:00","window_start":"2026-08-23T07:38:37+08:00"}
