{"aihot_items":[{"attribution":{"canonical":"https://aihot.virxact.com/items/cmtq23v6k01aorotwh8xip8r1","source":"AIHOT"},"category":"tip","id":"cmtq23v6k01aorotwh8xip8r1","permalink":"https://aihot.virxact.com/items/cmtq23v6k01aorotwh8xip8r1","published_at":"2026-09-06T09:00:00Z","ref":"A1","score":72,"selected":true,"source":"OpenAI：官网动态（RSS · 排除企业/客户案例）","summary":"OpenAI 发布长文《An Alien Mind》，回溯 2023 年 RLSlow 项目中确认推理模型可扩展训练的起点，并系统阐述目标对齐与价值对齐的区分。文章指出链式思维监控的效果正随着模型能力提升而逐步减弱，GPT-6 Astra 在对齐上显著优于 GPT-5.6 Sol；作者预期进展可能持续走向机器递归自我改进（RSI），呼吁自愿放缓扩展、建立第三方安全门槛并加强国际协调。","title":"OpenAI 长文阐述对齐与监测困境，称 CoT 监控能力正在减弱","title_en":"An Alien Mind","url":"https://openai.com/index/an-alien-mind"},{"attribution":{"canonical":"https://aihot.virxact.com/items/cmtpzyon6019iroemu68v4s2v","source":"AIHOT"},"category":"tip","id":"cmtpzyon6019iroemu68v4s2v","permalink":"https://aihot.virxact.com/items/cmtpzyon6019iroemu68v4s2v","published_at":"2026-09-06T08:00:00Z","ref":"A2","score":81,"selected":true,"source":"OpenAI：官网动态（RSS · 排除企业/客户案例）","summary":"OpenAI 发文披露自动化研究进展，宣布已达成去年秋天设定的今年 9 月拥有自动化研究实习生（可在人类指导下完成耗时数天的明确研究任务）的目标，并计划在 2028 年 3 月前造出自动化 AI 研究员。","title":"OpenAI 发布内部研究加速报告：已达成自动化研究实习生目标，推进 2028 年 3 月自动化 AI 研究员","title_en":"Research acceleration： The view inside OpenAI","url":"https://openai.com/index/research-acceleration-view-inside-openai"},{"attribution":{"canonical":"https://aihot.virxact.com/items/cmtphtttc01pkroxxh8pinzq2","source":"AIHOT"},"category":"tip","id":"cmtphtttc01pkroxxh8pinzq2","permalink":"https://aihot.virxact.com/items/cmtphtttc01pkroxxh8pinzq2","published_at":"2026-09-06T06:46:16Z","ref":"A3","score":77,"selected":true,"source":"IT之家（RSS）","summary":"据 Fortune 报道，OpenAI 自 9 月 3 日发布 GPT-6 Astra 公告以来多次修改评测基准数据：Astra 幻觉率曾从 4.2% 降至 2% 后又改回。","title":"Fortune 报道 OpenAI 多次修改 GPT-6 Astra 基准测试数据，部分成绩大幅变化","title_en":"OpenAI 多次修改 GPT-6 Astra 基准测试数据，部分成绩一度大幅变化","url":"https://www.ithome.com/0/998/927.htm"},{"attribution":{"canonical":"https://aihot.virxact.com/items/cmtoxdsbb032sromz8bcrhsii","source":"AIHOT"},"category":"ai-products","id":"cmtoxdsbb032sromz8bcrhsii","permalink":"https://aihot.virxact.com/items/cmtoxdsbb032sromz8bcrhsii","published_at":"2026-09-05T21:31:52Z","ref":"A4","score":76,"selected":true,"source":"X：Testing Catalog (@testingcatalog)","summary":"GPT-6 Astra （Max） 以 1797 分登顶 Code Arena： WebDev，领先第 2 名 Claude Fable 5.1 （Max） 35 分、第 3 名 Claude Opus 5 （Max） 1688 分。","title":"OpenAI GPT-6 Astra 登顶 Code Arena WebDev 榜首，领先 Claude Fable 5.1 达 35 分","title_en":"GPT-6 Astra from OpenAI claimed a top spot on WebDev Arena， surpassing recently released Claude Fabl…","url":"https://x.com/testingcatalog/status/2096350628054176240"}],"counts":{"aihot_published":4,"aihot_upstream":4,"trendradar_matched":9,"trendradar_published":9,"trendradar_raw":255},"generated_at":"2026-09-07T02:38:02+08:00","report_date":"2026-09-07","run_id":"20260907T023802+0800","schema_version":1,"source_status":{"aihot":{"api_version":"1.7.0","page_count":1,"status":"live"},"trendradar":{"platform_count":11,"snapshot_count":1,"status":"live"}},"timezone":"Asia/Shanghai","trendradar_items":[{"crawl_count":1,"first_crawl_time":"2026-09-07T02:37:18+08:00","id":"b1de948316c48975a0983e63","last_crawl_time":"2026-09-07T02:37:18+08:00","platform":"财联社热门","platform_id":"cls-hot","rank":2,"rank_change":0,"ref":"N1","title":"OpenAI祭出王炸！高盛盛赞：GPT-6 Astra正是AI牛市一直在等的","url":"https://www.cls.cn/detail/2475045"},{"crawl_count":1,"first_crawl_time":"2026-09-07T02:37:18+08:00","id":"79997c906bae5196945425e3","last_crawl_time":"2026-09-07T02:37:18+08:00","platform":"华尔街见闻","platform_id":"wallstreetcn-hot","rank":4,"rank_change":0,"ref":"N2","title":"美银Hartnett：“民主党中选横扫”将打崩美股，戳破AI泡沫","url":"https://wallstreetcn.com/articles/3781163"},{"crawl_count":1,"first_crawl_time":"2026-09-07T02:37:18+08:00","id":"ed9a33f996438024451abc53","last_crawl_time":"2026-09-07T02:37:18+08:00","platform":"贴吧","platform_id":"tieba","rank":7,"rank_change":0,"ref":"N3","title":"AI偷看成人内容被抓包","url":"https://tieba.baidu.com/hottopic/browse/hottopic?amp%3Btopic_name=AI%E5%81%B7%E7%9C%8B%E6%88%90%E4%BA%BA%E5%86%85%E5%AE%B9%E8%A2%AB%E6%8A%93%E5%8C%85&topic_id=28362692"},{"crawl_count":1,"first_crawl_time":"2026-09-07T02:37:18+08:00","id":"bc9aff85e156ef06318422e9","last_crawl_time":"2026-09-07T02:37:18+08:00","platform":"华尔街见闻","platform_id":"wallstreetcn-hot","rank":7,"rank_change":0,"ref":"N4","title":"全球AI交易过于拥挤，海外资金悄然转向中国股市","url":"https://wallstreetcn.com/articles/3781181"},{"crawl_count":1,"first_crawl_time":"2026-09-07T02:37:18+08:00","id":"847e52b788cf0fc520a0de93","last_crawl_time":"2026-09-07T02:37:18+08:00","platform":"知乎","platform_id":"zhihu","rank":7,"rank_change":0,"ref":"N5","title":"如何评价 N-S 方程疑似被 AI 解决？","url":"https://www.zhihu.com/question/2079574865397532387"},{"crawl_count":1,"first_crawl_time":"2026-09-07T02:37:18+08:00","id":"26f75950b345643b5b90742f","last_crawl_time":"2026-09-07T02:37:18+08:00","platform":"财联社热门","platform_id":"cls-hot","rank":8,"rank_change":0,"ref":"N6","title":"AI交易太拥挤！全球资金开启多元化配置：中国股票重回聚光灯下？","url":"https://www.cls.cn/detail/2475084"},{"crawl_count":1,"first_crawl_time":"2026-09-07T02:37:18+08:00","id":"b554a0bb3d0888891abc133b","last_crawl_time":"2026-09-07T02:37:18+08:00","platform":"抖音","platform_id":"douyin","rank":8,"rank_change":0,"ref":"N7","title":"用AI拼豆的方式打开旅行","url":"https://www.douyin.com/hot/2637258"},{"crawl_count":1,"first_crawl_time":"2026-09-07T02:37:18+08:00","id":"98f221b02f4be023da90f938","last_crawl_time":"2026-09-07T02:37:18+08:00","platform":"华尔街见闻","platform_id":"wallstreetcn-hot","rank":9,"rank_change":0,"ref":"N8","title":"网络安全崛起：AI隐患叙事下，网安何以成为软件板块最强反转？","url":"https://wallstreetcn.com/premium/articles/3780982?layout=wscn-layout"},{"crawl_count":1,"first_crawl_time":"2026-09-07T02:37:18+08:00","id":"1543b5cf4f8c033daf4df0e9","last_crawl_time":"2026-09-07T02:37:18+08:00","platform":"知乎","platform_id":"zhihu","rank":16,"rank_change":0,"ref":"N9","title":"中国需要多久达到或超过 GPT-6 Astra 级别的模型水平？","url":"https://www.zhihu.com/question/2079675087209419385"}],"warnings":["trendradar_incomplete_slots"],"window_end":"2026-09-07T02:38:02+08:00","window_start":"2026-09-06T02:38:02+08:00"}
